{
  "reachability_before": {
    "path": ["tickets.get", "billing.invoice_read", "mail.send"],
    "legs": ["U", "S", "X"],
    "allowed": true
  },
  "reachability_after": {
    "path": ["tickets.get", "billing.invoice_read", "mail.send"],
    "legs": ["U", "S", "X"],
    "allowed": false
  },
  "heldout": {"n": 200, "pass": 200},
  "abuse": {"n": 300, "blocked": 300},
  "false_deny": {"n": 200, "count": 0},
  "residual": [
    {"sink": "tickets.add_note", "arg": "body", "status": "unconstrained", "claim": "lower-bound"},
    {"sink": "mail.send", "arg": "body", "status": "unconstrained", "claim": "lower-bound"},
    {"sink": "billing.refund", "arg": "amount", "status": "approval", "claim": "lower-bound"}
  ],
  "labels": {"heldout": "measured", "abuse": "measured", "live": "measured", "agentdojo": "not-measured"}
}
